{
  "schema_version": 1,
  "observed_at_utc": "2026-10-08T12:47:14Z",
  "gold_publication": "msflix-native-masters-20261008T053100Z",
  "provenance": "Bounded read-only sample of native Salesforce BPS and the Oracle mirror, cross-referenced with MSFlixGold. CRM identities are fictional. This is not a live source connection.",
  "customers": [
    {"customer_key": "MSF-C0001", "name": "Camille Delorme", "territory": "FR", "salesforce_contact_id": "003aj00002Tu8h7AAB"},
    {"customer_key": "MSF-C0005", "name": "Romain Delorme", "territory": "FR", "salesforce_contact_id": "003aj00002Tu8hBAAR"},
    {"customer_key": "MSF-C0009", "name": "Hugo Delorme", "territory": "FR", "salesforce_contact_id": "003aj00002Tu8hFAAR"}
  ],
  "contents": [
    {"content_key": "MSF-FILM-BUNNY", "title": "Big Buck Bunny", "distributor_key": "BLENDER-FOUNDATION"},
    {"content_key": "MSF-FILM-SINTEL", "title": "Sintel", "distributor_key": "BLENDER-FOUNDATION"},
    {"content_key": "MSF-FILM-SPRING", "title": "Spring", "distributor_key": "BLENDER-FOUNDATION"}
  ],
  "distributors": [
    {"distributor_key": "BLENDER-FOUNDATION", "name": "Blender Foundation", "sap_partner_code": null}
  ],
  "existing_offer_context": {
    "territory": "FR",
    "currency": "EUR",
    "rental_minor": 399,
    "purchase_minor": 1299,
    "tax_basis": "Unknown: do not reinterpret existing prices as HT or TTC",
    "policy": "Existing TVOD/EST orders and offers are not modified or invoiced by this scenario"
  }
}
